{
  "$schema": "https://json-schema.org/draft/2020-12/schema",
  "type": "object",
  "properties": {
    "research_version": {
      "const": 2
    },
    "proposal_only": {
      "const": true
    },
    "events": {
      "type": "array",
      "items": {
        "type": "object",
        "properties": {
          "event_id": {
            "type": "string"
          },
          "scope": {
            "enum": [
              "company",
              "sector",
              "macro",
              "geopolitical",
              "other"
            ]
          },
          "event_type": {
            "type": "string"
          },
          "securities": {
            "type": "array",
            "items": {
              "type": "string"
            }
          },
          "sectors": {
            "type": "array",
            "items": {
              "type": "string"
            }
          },
          "factual_summary": {
            "type": "string"
          },
          "evidence_refs": {
            "type": "array",
            "items": {
              "type": "string"
            }
          },
          "supporting_quotations": {
            "type": "array",
            "items": {
              "type": "object",
              "properties": {
                "evidence_id": {
                  "type": "string"
                },
                "quote": {
                  "type": "string"
                }
              },
              "required": [
                "evidence_id",
                "quote"
              ],
              "additionalProperties": false
            }
          },
          "event_verification": {
            "enum": [
              "PRIMARY_CONFIRMED",
              "MULTI_SOURCE_REPORTED",
              "SINGLE_SOURCE_REPORTED",
              "UNVERIFIED"
            ]
          },
          "unresolved_questions": {
            "type": "array",
            "items": {
              "type": "string"
            }
          }
        },
        "required": [
          "event_id",
          "scope",
          "event_type",
          "securities",
          "sectors",
          "factual_summary",
          "evidence_refs",
          "supporting_quotations",
          "event_verification",
          "unresolved_questions"
        ],
        "additionalProperties": false
      }
    },
    "movement_assessments": {
      "type": "array",
      "items": {
        "type": "object",
        "properties": {
          "subject": {
            "type": "string"
          },
          "linked_event_ids": {
            "type": "array",
            "items": {
              "type": "string"
            }
          },
          "attribution": {
            "enum": [
              "SUPPORTED_CATALYST",
              "PLAUSIBLE_CATALYST",
              "SECTOR_CO_MOVEMENT",
              "UNEXPLAINED"
            ]
          },
          "rationale": {
            "type": "string"
          },
          "alternative_interpretations": {
            "type": "array",
            "items": {
              "type": "string"
            }
          },
          "evidence_refs": {
            "type": "array",
            "items": {
              "type": "string"
            }
          },
          "abstention_reason": {
            "type": "string"
          }
        },
        "required": [
          "subject",
          "linked_event_ids",
          "attribution",
          "rationale",
          "alternative_interpretations",
          "evidence_refs",
          "abstention_reason"
        ],
        "additionalProperties": false
      }
    },
    "claims": {
      "type": "array",
      "items": {
        "type": "object",
        "properties": {
          "claim_id": {
            "type": "string"
          },
          "event_id": {
            "type": "string"
          },
          "claim_type": {
            "enum": [
              "EVENT_FACT",
              "NUMERIC_FACT",
              "INTERPRETATION",
              "CAUSAL_ATTRIBUTION"
            ]
          },
          "subject": {
            "type": "string"
          },
          "predicate": {
            "type": "string"
          },
          "entities": {
            "type": "array",
            "items": {
              "type": "string"
            }
          },
          "citations": {
            "type": "array",
            "items": {
              "type": "object",
              "properties": {
                "evidence_id": {
                  "type": "string"
                },
                "quote": {
                  "type": "string"
                }
              },
              "required": [
                "evidence_id",
                "quote"
              ],
              "additionalProperties": false
            }
          },
          "event_time": {
            "type": [
              "string",
              "null"
            ]
          },
          "metric": {
            "type": "string"
          },
          "value": {
            "type": "string"
          },
          "unit": {
            "type": "string"
          }
        },
        "required": [
          "claim_id",
          "event_id",
          "claim_type",
          "subject",
          "predicate",
          "entities",
          "citations",
          "event_time",
          "metric",
          "value",
          "unit"
        ],
        "additionalProperties": false
      }
    }
  },
  "required": [
    "research_version",
    "proposal_only",
    "events",
    "movement_assessments"
  ],
  "additionalProperties": false
}